results/phase8_comparison_audit/summary.csv

experiment_id,scenario_id,configuration,active_flows,bottleneck_data_rate,queue_limit_packets,random_seed,run_number,aggregate_application_throughput_bps,aggregate_application_throughput_mbps,per_flow_throughput_bps,mean_delay_s,p95_flow_mean_delay_s,jain_fairness,physical_queue_max_packets,physical_queue_limit_packets,queuedisc_aggregate_max_packets,queuedisc_limit_packets,logical_queue_max_packets,logical_queue_limit_packets,physical_queue_drop_events,internal_queuedisc_drop_events,flowmonitor_lost_packets,dqa_transition_count,hybrid_dedicated_records,hybrid_shared_records,hybrid_release_events,hybrid_promotion_events
3f_2Mbps_10p_baseline,3f_2Mbps_10p,baseline,3,2Mbps,10,1,1,1907996.4444444445,1.9079964444444446,611040.000000;664000.000000;632956.444444,0.04958566666666667,0.050561600000000005,0.998834253743701,10,10,0,,0,,0,0,58,0,0,0,0,0
3f_2Mbps_10p_dqa,3f_2Mbps_10p,dqa,3,2Mbps,10,1,1,1913162.6666666665,1.9131626666666666,743968.000000;666545.777778;502648.888889,0.050779333333333336,0.0526992,0.9757172915189878,10,10,10,10,6,10,0,0,79,6,0,0,0,0
3f_2Mbps_10p_hybrid,3f_2Mbps_10p,hybrid,3,2Mbps,10,1,1,1912448.0,1.912448,659875.555556;684174.222222;568398.222222,0.049516666666666674,0.0515776,0.9939229065229098,10,10,10,10,6,10,0,0,80,0,10,10,6,2
3f_2Mbps_50p_baseline,3f_2Mbps_50p,baseline,3,2Mbps,50,1,1,1912686.2222222222,1.9126862222222223,658446.222222;653920.000000;600320.000000,0.122872,0.1232832,0.9982884803915079,50,50,0,,0,,0,0,41,0,0,0,0,0
3f_2Mbps_50p_dqa,3f_2Mbps_50p,dqa,3,2Mbps,50,1,1,1913400.888888889,1.913400888888889,708949.333333;516227.555556;688224.000000,0.21076166666666665,0.2578713,0.9819878295232135,50,50,50,50,26,50,0,0,61,0,0,0,0,0
3f_2Mbps_50p_hybrid,3f_2Mbps_50p,hybrid,3,2Mbps,50,1,1,1912448.0,1.912448,704423.111111;754688.000000;453336.888889,0.21720899999999999,0.2410971,0.9589958378646556,50,50,50,50,18,50,0,0,66,0,10,10,6,2
3f_5Mbps_10p_baseline,3f_5Mbps_10p,baseline,3,5Mbps,10,1,1,4687555.555555556,4.687555555555556,1560000.000000;1560888.888889;1566666.666667,0.02879166666666667,0.029168799999999998,0.9999964221376655,10,10,0,,0,,0,0,64,0,0,0,0,0
3f_5Mbps_10p_dqa,3f_5Mbps_10p,dqa,3,5Mbps,10,1,1,4601333.333333333,4.601333333333333,1597777.777778;1408444.444444;1595111.111111,0.025369000000000003,0.025791599999999998,0.9966719024561457,10,10,10,10,6,10,0,0,91,4,0,0,0,0
3f_5Mbps_10p_hybrid,3f_5Mbps_10p,hybrid,3,5Mbps,10,1,1,4616444.444444444,4.616444444444444,1159111.111111;1594222.222222;1863111.111111,0.025608000000000002,0.0257678,0.9656873516194576,10,10,10,10,4,10,0,0,84,0,10,10,6,2
3f_5Mbps_50p_baseline,3f_5Mbps_50p,baseline,3,5Mbps,50,1,1,4697333.333333333,4.697333333333333,1627555.555556;1500444.444444;1569333.333333,0.057651666666666664,0.0583443,0.9989002451765943,50,50,0,,0,,0,0,40,0,0,0,0,0
3f_5Mbps_50p_dqa,3f_5Mbps_50p,dqa,3,5Mbps,50,1,1,4701333.333333333,4.701333333333333,1820000.000000;1152000.000000;1729333.333333,0.08797133333333333,0.1062665,0.9655854902883628,50,50,49,50,25,50,0,0,83,0,0,0,0,0
3f_5Mbps_50p_hybrid,3f_5Mbps_50p,hybrid,3,5Mbps,50,1,1,4698222.222222222,4.698222222222222,1818666.666667;1578666.666667;1300888.888889,0.08734633333333335,0.0917912,0.9820763615635316,50,50,49,50,17,50,0,0,78,0,10,10,6,2
10f_2Mbps_10p_baseline,10f_2Mbps_10p,baseline,10,2Mbps,10,1,1,1904824.888888889,1.904824888888889,187719.111111;188195.555556;207015.111111;192483.555556;179857.777778;193674.666667;187957.333333;200821.333333;174855.111111;192245.333333,0.08351929999999999,0.08608615,0.9978717194522819,10,10,0,,0,,0,0,240,0,0,0,0,0
10f_2Mbps_10p_dqa,10f_2Mbps_10p,dqa,10,2Mbps,10,1,1,1911495.111111111,1.911495111111111,393781.333333;377344.000000;334702.222222;246560.000000;276576.000000;26442.666667;152224.000000;53123.555556;33827.555556;16913.777778,0.0533361,0.06127449999999999,0.6355698775109543,10,10,10,10,8,10,0,0,305,13,0,0,0,0
10f_2Mbps_10p_hybrid,10f_2Mbps_10p,hybrid,10,2Mbps,10,1,1,1908160.0,1.90816,205824.000000;155559.111111;121255.111111;261568.000000;190101.333333;244654.222222;268476.444444;191768.888889;144362.666667;124590.222222,0.055981,0.08024119999999998,0.93147080113623,10,10,10,10,6,10,0,0,377,0,26,48,20,14
10f_2Mbps_50p_baseline,10f_2Mbps_50p,baseline,10,2Mbps,50,1,1,1913162.6666666665,1.9131626666666666,180572.444444;187480.888889;189148.444444;197486.222222;189863.111111;195580.444444;182716.444444;183192.888889;204632.888889;202488.888889,0.1599245,0.16573715,0.9982672823299448,50,50,0,,0,,0,0,130,0,0,0,0,0
10f_2Mbps_50p_dqa,10f_2Mbps_50p,dqa,10,2Mbps,50,1,1,1912448.0,1.912448,166993.777778;183431.111111;212732.444444;155797.333333;207491.555556;180572.444444;304209.777778;182716.444444;160800.000000;157703.111111,0.21356860000000003,0.22716034999999998,0.9540112600617151,50,50,50,50,26,50,0,0,132,0,0,0,0,0
10f_2Mbps_50p_hybrid,10f_2Mbps_50p,hybrid,10,2Mbps,50,1,1,1905777.7777777778,1.9057777777777778,53838.222222;58364.444444;66702.222222;203918.222222;578641.777778;184860.444444;140551.111111;194389.333333;326602.666667;97909.333333,0.3081024,0.6302299,0.6102810229683078,50,50,50,50,33,50,0,0,102,0,26,48,20,14
10f_5Mbps_10p_baseline,10f_5Mbps_10p,baseline,10,5Mbps,10,1,1,4779928.888888889,4.779928888888889,483591.111111;482876.444444;482876.444444;480256.000000;469059.555556;481447.111111;470012.444444;468583.111111;467153.777778;494072.888889,0.044354199999999996,0.04493685,0.999691889055428,10,10,0,,0,,0,0,252,0,0,0,0,0
10f_5Mbps_10p_dqa,10f_5Mbps_10p,dqa,10,5Mbps,10,1,1,4738240.0,4.73824,579356.444444;525756.444444;590076.444444;512654.222222;417365.333333;456672.000000;571018.666667;296586.666667;399022.222222;389731.555556,0.027689199999999997,0.028714049999999998,0.9631632019415374,10,10,10,10,6,10,0,0,562,6,0,0,0,0
10f_5Mbps_10p_hybrid,10f_5Mbps_10p,hybrid,10,5Mbps,10,1,1,4736810.666666667,4.736810666666667,375676.444444;434755.555556;469536.000000;651537.777778;357571.555556;557678.222222;517656.888889;440234.666667;403548.444444;528615.111111,0.0275433,0.031530499999999996,0.9679486522870535,10,10,9,10,5,10,0,0,543,0,26,48,20,14
10f_5Mbps_50p_baseline,10f_5Mbps_50p,baseline,10,5Mbps,50,1,1,4781834.666666667,4.781834666666667,470250.666667;498837.333333;486926.222222;501696.000000;499313.777778;469059.555556;486926.222222;436423.111111;477397.333333;455004.444444,0.0759729,0.07688425,0.9982507776836077,50,50,0,,0,,0,0,168,0,0,0,0,0
10f_5Mbps_50p_dqa,10f_5Mbps_50p,dqa,10,5Mbps,50,1,1,4783768.888888889,4.783768888888889,504554.666667;379964.444444;572000.000000;490976.000000;467630.222222;287296.000000;451907.555556;443331.555556;461912.888889;724195.555556,0.0928554,0.09480055,0.9507483426356478,50,50,50,50,26,50,0,0,188,0,0,0,0,0
10f_5Mbps_50p_hybrid,10f_5Mbps_50p,hybrid,10,5Mbps,50,1,1,4779701.333333333,4.779701333333333,214876.444444;189386.666667;337333.333333;720622.222222;611516.444444;443808.000000;568874.666667;695847.111111;519086.222222;478350.222222,0.1119261,0.21025579999999996,0.8813397377901969,50,50,50,50,25,50,0,0,168,0,26,48,20,14

Explanation.md

## 8. Do the improvements actually improve performance?

- 3 flows, 2 Mbps, 10 packets: baseline 1.9080 Mbps, DQA 1.9132 Mbps,
  hybrid 1.9124 Mbps.
- 3 flows, 5 Mbps, 10 packets: baseline 4.6876 Mbps, DQA 4.6013 Mbps,
  hybrid 4.6164 Mbps.
- 10 flows, 5 Mbps, 50 packets: baseline 4.7818 Mbps, DQA 4.7838 Mbps,
  hybrid 4.7797 Mbps.